question,answer,type, category,topic, source
"Define encryption and decryption.","Encryption, also known as enciphering, is the process of converting plaintext into ciphertext, typically using an algorithm or cryptographic system. This ensures that the original message is hidden from unauthorized parties. Decryption, on the other hand, is the reverse process of converting ciphertext back into plaintext, allowing authorized users to retrieve the original message. These processes are fundamental in ensuring the security and confidentiality of sensitive information, especially in communication and data storage systems.","orig","word","cipher","cns-ch3"
"Explain the field of cryptography.","Cryptography encompasses the study and practice of creating secure communication channels through the use of encryption techniques. It involves developing cryptographic systems or ciphers to encode messages in such a way that only authorized parties can decipher them. The field is crucial in safeguarding sensitive data from interception and unauthorized access. Cryptographers continually innovate new methods to strengthen encryption and protect against emerging threats in the digital age.","orig","word","cipher","cns-ch3"
"What is cryptanalysis?","Cryptanalysis is the process of analyzing encrypted messages with the aim of deciphering their original plaintext content, typically without having access to the encryption key or method. It involves using various techniques and methodologies to break encryption algorithms and uncover the hidden message. Cryptanalysts employ mathematical analysis, statistical methods, and computational algorithms to exploit weaknesses in cryptographic systems and reveal encrypted information. Cryptanalysis plays a vital role in assessing the security of encryption schemes and developing more robust cryptographic techniques. It is often referred to colloquially as 'breaking the code.","orig","word","cipher","cns-ch3"
"What is cryptology?","Cryptology is the interdisciplinary field that encompasses both cryptography and cryptanalysis. It involves the study of secure communication techniques, including the development of encryption methods to protect data and the analysis of cryptographic systems to detect vulnerabilities. Cryptology encompasses the broader study of cryptographic principles, applications, and technologies, aiming to advance the security and confidentiality of information in various domains, including cybersecurity, telecommunications, and information technology.","orig","word","cipher","cns-ch3"
"Define plaintext and ciphertext in cryptography.","Plaintext refers to the original, unencrypted message that is understandable to humans. In contrast, ciphertext is the encoded or encrypted form of the plaintext, which is unintelligible without decryption. The conversion of plaintext into ciphertext is a fundamental aspect of cryptography, providing confidentiality and security to sensitive information during transmission or storage.","orig","word","cipher","cns-ch3"
"Could you describe plaintext and ciphertext in cryptography?","Plaintext is the clear, unencrypted message that humans can understand. Conversely, ciphertext is the encoded or encrypted version of the plaintext, which is indecipherable without decryption. Converting plaintext to ciphertext is a crucial element of cryptography, ensuring the confidentiality and security of sensitive information during transmission or storage.","rephr","word","cipher","cns-ch3"
"What is the main security worry regarding symmetric encryption?","The primary concern in symmetric encryption is ensuring the secrecy of the key. While the encryption/decryption algorithm doesn't require secrecy, it's crucial to keep the key confidential for the security of the encrypted communication. Although decrypting a message based solely on the ciphertext and algorithm knowledge is assumed to be impractical, the security of symmetric encryption depends on protecting the key's secrecy. This aspect of symmetric encryption allows for widespread adoption, as manufacturers can create low-cost chip implementations of encryption algorithms without the need to hide the algorithm itself.","rephr","word","cipher","cns-ch3"
"Explain the components of a symmetric encryption scheme.","A symmetric encryption scheme involves five components:\\ 1. Plaintext: This is the original message or data in a readable form, which serves as input to the encryption algorithm.\\ 2. Encryption algorithm: The encryption algorithm processes the plaintext, performing various substitutions and transformations to generate ciphertext.\\ 3. Secret key: A secret key, independent of both the plaintext and the algorithm, is provided as input to the encryption algorithm. The specific key used determines the transformations applied to the plaintext.\\ 4. Ciphertext: The ciphertext is the encrypted output produced by the algorithm. It depends on both the plaintext and the secret key. Different keys will yield different ciphertexts for the same plaintext.\\ 5. Decryption algorithm: The decryption algorithm, essentially the encryption algorithm in reverse, takes the ciphertext and the secret key as input and produces the original plaintext. It reverses the transformations applied during encryption to recover the original message.","orig","word","cipher","cns-ch3"
"Explain the requirements for secure use of conventional encryption or symmetric encryption.","Secure use of conventional encryption or symmetric encryption requires two key components:\\ 1. Strong encryption algorithm: The encryption algorithm must be robust enough to withstand attacks by adversaries who possess knowledge of the algorithm and have access to one or more ciphertexts. Ideally, even with access to multiple ciphertexts and their corresponding plaintexts, the adversary should be unable to decipher the ciphertext or determine the encryption key. This requirement emphasizes the need for algorithms that resist decryption attempts, ensuring the confidentiality of the encrypted data.\\ 2. Secure key management: Both the sender and receiver must securely obtain and safeguard copies of the secret key. If an unauthorized party gains access to the key and possesses knowledge of the encryption algorithm, they can easily decrypt any communication encrypted using that key. Therefore, ensuring the confidentiality of the key is essential to maintaining the security of the encrypted communication.","orig","word","cipher","cns-ch3"
"Explain symmetric encryption.","Symmetric encryption, also known as conventional encryption or single-key encryption, was the sole encryption method utilized before the emergence of public-key encryption in the 1970s. In symmetric encryption, the same key is used for both encryption and decryption processes. This contrasts with public-key encryption, where separate keys are employed for encryption and decryption. Symmetric encryption algorithms rely on the secrecy of the shared key to ensure the confidentiality of the transmitted data. While symmetric encryption is efficient and fast, its security hinges on the secure distribution and management of the secret key among communicating parties.","orig","word","cipher","cns-ch3"
"What is the principal security concern in symmetric encryption?","The principal security concern in symmetric encryption is maintaining the secrecy of the key. Unlike the encryption/decryption algorithm, which does not need to be kept secret, the key must be kept confidential to ensure the security of the encrypted communication. While it is assumed to be impractical to decrypt a message solely based on the ciphertext and knowledge of the algorithm, the security of symmetric encryption hinges on safeguarding the secrecy of the key. This characteristic of symmetric encryption enables its widespread use, as manufacturers can develop low-cost chip implementations of encryption algorithms without needing to conceal the algorithm itself.","orig","word","cipher","cns-ch3"
"What are the essential elements of a symmetric encryption scheme? Explain with an example where the plain message is \( X \) with \( M \) elements, encryption algorithm is \( E \), decryption algorithm is \( D \) and cipher message is \( Y \) with \( N \) elements"," The essential elements of a symmetric encryption scheme include the plaintext message, the encryption key, the encryption algorithm, the ciphertext, and the decryption algorithm. In a symmetric encryption scheme, a plaintext message \( X = [X_1, X_2, \ldots, X_M] \), consisting of \( M \) elements typically represented as letters in a finite alphabet, is encrypted using a key \( K = [K_1, K_2, \ldots, K_J] \). The encryption algorithm, denoted as \( E \), transforms the plaintext message \( X \) into ciphertext \( Y = [Y_1, Y_2, \ldots, Y_N] \), where \( N \) is the length of the ciphertext. This encryption process is expressed as \( Y = E(K, X) \), indicating that \( Y \) is generated by applying the encryption algorithm \( E \) to the plaintext \( X \) using the encryption key \( K \). The recipient, possessing the same key \( K \), is able to reverse the encryption process using the decryption algorithm \( D \), such that \( X = D(K, Y) \). However, an opponent, who only has access to the ciphertext \( Y \) without knowledge of the encryption key \( K \) or the plaintext \( X \), may attempt to recover either the plaintext \( X \), the encryption key \( K \), or both. This assumes that the opponent is familiar with both the encryption (\( E \)) and decryption (\( D \)) algorithms. Depending on the objective, the opponent may aim to recover the plaintext \( X \) or the encryption key \( K \), or both, in order to decipher the encrypted message.","orig","word","cipher","cns-ch3"
"Explain the basic procedures employed to convert plaintext into ciphertext in encryption algorithms. How do these procedures guarantee reversibility and enhance encryption system security?","Encryption algorithms primarily utilize substitution and transposition as fundamental operations. Substitution assigns each plaintext element to another element, while transposition rearranges elements. These procedures must be reversible to prevent information loss. Many encryption systems incorporate multiple layers of substitutions and transpositions, termed product systems. The reversibility of these procedures ensures the decryption of encrypted data, thereby bolstering encryption system security.","rephr","word","cipher","cns-ch3"
"Describe the fundamental operations used for transforming plaintext into ciphertext in encryption algorithms. How do these operations ensure reversibility and contribute to the security of encryption systems?","The fundamental operations in encryption algorithms involve substitution and transposition. Substitution maps each element in the plaintext to another element, while transposition rearranges elements. These operations must be reversible to ensure no information loss. Most encryption systems employ multiple stages of substitutions and transpositions, known as product systems. The reversibility of these operations ensures that encrypted data can be decrypted, contributing to the security of encryption systems.","orig","math","cipher","cns-ch3"
"What are the different types of encryption systems based on the key usage between sender and receiver?","Encryption systems are classified based on key usage between sender and receiver. If both parties use the same key, it's known as symmetric, single-key, secret-key, or conventional encryption. Conversely, if the sender and receiver use different keys, the system is referred to as asymmetric, two-key, or public-key encryption.","orig","math","cipher","cns-ch3"
"What are the different types of encryption systems based on the way in which the plaintext is processed?","The processing of plaintext in encryption algorithms defines two types of encryption systems or ciphers. Two common types of ciphers are block ciphers and stream ciphers:\\- Block Cipher: A block cipher processes the input one block of elements at a time, typically a fixed-size block such as 64 or 128 bits. It operates on entire blocks of plaintext simultaneously and produces an output block for each input block. Block ciphers often use complex substitution and permutation operations within each block to generate ciphertext.\\- Stream Cipher: In contrast, a stream cipher processes the input elements continuously, producing output one element at a time as it goes along. It encrypts individual elements of the plaintext stream using a keystream generated from the encryption key. Stream ciphers are often implemented using bitwise operations or simple arithmetic operations to combine plaintext and keystream elements.\\Both block ciphers and stream ciphers play crucial roles in modern encryption systems, offering different trade-offs in terms of security, efficiency, and implementation complexity.","orig","word","cipher","cns-ch3"
"What are the two general approaches to attacking a conventional encryption scheme?","Two general approaches to attacking a conventional encryption scheme are cryptanalysis and brute-force attack. Cryptanalysis relies on the nature of the algorithm and possibly some knowledge of the plaintext characteristics or sample plaintext - ciphertext pairs to deduce either a specific plaintext or the key being used. On the other hand, in a brute-force attack, the attacker tries every possible key on a piece of ciphertext until an intelligible translation into plaintext is obtained. On average, half of all possible keys must be tried to achieve success. If either type of attack succeeds in deducing the key, all future and past messages encrypted with that key are compromised.","orig","word","cipher","cns-ch3"
"Describe the most difficult problem in cryptanalysis.","The most difficult problem in cryptanalysis arises when only the ciphertext is available to the cryptanalyst. Even if the encryption algorithm is unknown, it is generally assumed that the opponent knows the algorithm used for encryption. In such cases, one possible attack strategy is the brute-force approach, where the cryptanalyst tries all possible keys. However, if the key space is very large, this approach becomes impractical. Therefore, the cryptanalyst must rely on analyzing the ciphertext itself, often employing various statistical tests. To use this approach effectively, the cryptanalyst typically needs some general idea of the type of plaintext concealed, such as English or French text, an executable file, a Java source listing, or an accounting file.","orig","word","cipher","cns-ch3"
"Explain the brute-force approach in cryptanalysis.","In cryptanalysis, the brute-force approach involves trying all possible keys to decrypt a ciphertext when the encryption algorithm and ciphertext are known, but the key is unknown. This method is often employed when the key space, or the total number of possible keys, is relatively small. However, if the key space is very large, as is the case with strong encryption schemes, the brute-force approach becomes impractical due to the enormous computational effort required. Cryptanalysts resort to other methods, such as analyzing the ciphertext statistically or using known plaintext-ciphertext pairs, to deduce the key more efficiently.","orig","word","cipher","cns-ch3"
"Explain the types of cryptanalytic attacks based on the amount of information known to the cryptanalyst.","Cryptanalysis encompasses various types of attacks based on the information available to the cryptanalyst. These attacks can be categorized into several types depending on the level of knowledge possessed by the cryptanalyst:\\ 1. Ciphertext Only: The cryptanalyst has only the ciphertext at their disposal.\\ 2. Known Plaintext: The cryptanalyst possesses both the encryption algorithm and one or more plaintext-ciphertext pairs formed with the secret key.\\ 3. Chosen Plaintext: Similar to the known plaintext attack, but the cryptanalyst can choose plaintext messages and obtain their corresponding ciphertexts.\\ 4. Chosen Ciphertext: The cryptanalyst can choose ciphertexts and obtain their corresponding plaintexts.\\ 5. Chosen Text: A combination of chosen plaintext and chosen ciphertext attacks, where the cryptanalyst can choose both plaintext and ciphertext and obtain the corresponding plaintext and ciphertext pairs.","orig","word","cipher","cns-ch3"
"Explain the vulnerability of the ciphertext-only attack and the importance of additional information in cryptanalysis.","The ciphertext-only attack is considered relatively easy to defend against because the cryptanalyst has only the ciphertext at their disposal, providing minimal information for decryption. However, in many cases, the analyst may possess additional information, such as one or more plaintext messages and their corresponding encryptions, or knowledge of certain plaintext patterns that are likely to appear in a message. This additional information, known as known plaintext, significantly enhances the cryptanalyst's ability to deduce the encryption key. For example, certain file formats may have standardized headers or recognizable patterns at the beginning, facilitating the identification of known plaintext. With this knowledge, the analyst can analyze the transformation applied to the known plaintext and potentially deduce the encryption key, thereby undermining the security of the encryption scheme.","orig","word","cipher","cns-ch3"
"What makes the ciphertext-only attack vulnerable, and why is extra data crucial in cryptanalysis?", "The vulnerability of the ciphertext-only attack lies in its reliance solely on the encrypted text, which offers limited insights for decryption. However, additional information, such as known plaintext or identifiable patterns in messages, substantially boosts the cryptanalyst's ability to uncover the encryption key. For instance, certain file formats may contain standardized headers or recognizable structures at the start, simplifying the identification of known plaintext. Armed with this information, the analyst can scrutinize how the known plaintext transforms and potentially deduce the encryption key, thus compromising the encryption scheme's security.","rephr","word","cipher","cns-ch3"
"Explain the concept of a probable-word attack and its relationship to known-plaintext attacks.","A probable-word attack is closely related to a known-plaintext attack and involves the cryptanalyst exploiting specific information or patterns within a message to deduce the encryption key. While in a known-plaintext attack, the analyst possesses explicit knowledge of some plaintext and its corresponding ciphertext, in a probable-word attack, the analyst may have partial or probabilistic knowledge of certain words or phrases within the message. For instance, if the opponent targets specific information within a message, such as key phrases or recognizable patterns, they can leverage this knowledge to narrow down the possibilities for decryption. For example, in an accounting file transmission, the opponent may be aware of the positioning of certain keywords within the file header, facilitating the identification of probable words. Similarly, in the source code of a program developed by a specific entity, there may be copyright statements or standardized phrases that aid in identifying probable words. By leveraging these known or probable words, the cryptanalyst can enhance their decryption efforts and potentially recover the encryption key, thereby compromising the security of the encryption scheme.","orig","word","cipher","cns-ch3"
"Describe a chosen-plaintext attack and its implications for encryption security.","A chosen-plaintext attack occurs when the cryptanalyst can select and encrypt specific messages of their choice using the encryption system. This attack scenario poses significant threats to encryption security as it allows the analyst to deliberately choose plaintext inputs that can expose vulnerabilities or reveal the structure of the encryption key. By crafting messages with strategic patterns or characteristics, the analyst aims to exploit weaknesses in the encryption algorithm or key generation process. For instance, the analyst may intentionally select plaintext inputs designed to reveal common patterns, repetition, or biases in the encryption process, thereby aiding in the deduction or inference of the encryption key. If successful, the chosen-plaintext attack can compromise the confidentiality and integrity of the encrypted communication, undermining the security guarantees provided by the encryption scheme. Therefore, defending against chosen-plaintext attacks requires robust encryption algorithms and key management practices to withstand deliberate manipulation of plaintext inputs by adversaries.","orig","word","cipher","cns-ch3"
"Define unconditionally secure encryption scheme.","An unconditionally secure encryption scheme is one where the ciphertext generated provides no information that could uniquely determine the corresponding plaintext, regardless of the amount of available ciphertext or the computational power of the adversary. In simpler terms, even with unlimited time and resources, it is theoretically impossible for an attacker to decrypt the ciphertext without additional information. However, with the exception of the onetime pad scheme, achieving unconditional security in encryption algorithms is exceptionally rare.","orig","word","cipher","cns-ch3"
"Define computationally secure encryption scheme.","A computationally secure encryption scheme is characterized by the fact that the effort required to break the cipher—either in terms of computational resources or time—exceeds the value of the encrypted information or the useful lifetime of that information. In other words, while it may be theoretically possible to decrypt the ciphertext, the practical obstacles involved, such as the computational complexity or the time required, make it infeasible within a reasonable timeframe or with reasonable resources. However, accurately estimating the effort needed for cryptanalysis poses a significant challenge in practice.","orig","word","cipher","cns-ch3"
"What criteria do users typically aim for when selecting encryption algorithms?","The users of encryption algorithms typically strive for schemes that meet one or both of the following criteria: \\ 1. The cost of breaking the cipher exceeds the value of the encrypted information. \\ 2. The time required to break the cipher exceeds the useful lifetime of the information.","orig","word","cipher","cns-ch3"
"What is the objective of a brute-force attack in cryptography?","In cryptography, the objective of a brute-force attack is to try every possible key until an intelligible translation of the ciphertext into plaintext is obtained. This method aims to discover the correct encryption key when no information about the key or plaintext is available to the attacker.","orig","word","cipher","cns-ch3"
"How many keys must be tried on average in a brute-force attack to achieve success?","On average, half of all possible keys must be tried to achieve success in a brute-force attack. If there are $X$ different keys, the attacker would discover the actual key after $\frac{X}{2}$ tries.","orig","word","cipher","cns-ch3"
"Why is recognition of plaintext important in a brute-force attack?","Recognition of plaintext is crucial in a brute-force attack because it helps the attacker distinguish between successful and unsuccessful decryption attempts. If the plaintext is easily recognizable, such as plain English text, successful decryption is straightforward. However, if the plaintext is not readily identifiable, such as compressed or encoded data, the attacker faces greater challenges in distinguishing between correct and incorrect decryption attempts.","orig","word","cipher","cns-ch3"
"What is the requirement for strong encryption in the context of data protection?","In the context of data protection, there is a requirement for strong encryption, which refers to encryption schemes that make it impractically difficult for unauthorized persons or systems to gain access to encrypted plaintext. Strong encryption ensures robust security measures to safeguard sensitive information.","orig","word","cipher","cns-ch3"
"What are the properties that make an encryption algorithm strong according to [NAS18]?","According to [NAS18], the properties that make an encryption algorithm strong include: appropriate choice of cryptographic algorithm, use of sufficiently long key lengths, appropriate choice of protocols, a well-engineered implementation, and the absence of deliberately introduced hidden flaws. These elements collectively contribute to the strength and effectiveness of an encryption scheme.","orig","word","cipher","cns-ch3" 
"What is a substitution technique in encryption?","A substitution technique in encryption involves replacing the letters of plaintext with other letters, numbers, or symbols. Alternatively, if the plaintext is considered as a sequence of bits, substitution entails replacing plaintext bit patterns with corresponding ciphertext bit patterns.","orig","word","cipher","cns-ch3"
